{
  "schema": "https://raw.githubusercontent.com/SysAdminDoc/SysAdminDoc/main/schemas/profile-catalog.v1.json",
  "generatedAt": "2026-06-01T16:18:55.099894-04:00",
  "portfolioUrl": "https://portfolio.getparkerai.com/",
  "profileHeader": {
    "tagline": "Fix what bugs you. Keep control of the rest.",
    "about": "Hi! I'm Matt.",
    "links": [
      {
        "text": "More about what I do",
        "url": "https://portfolio.getparkerai.com/healthcare-it/"
      }
    ],
    "support": {
      "url": "https://ko-fi.com/X8K126YVER",
      "imageUrl": "https://storage.ko-fi.com/cdn/kofi2.png?v=3",
      "imageAlt": "Buy me a coffee on Ko-fi"
    }
  },
  "entries": [
    {
      "repo": "win11-nvme-driver-patcher",
      "title": "win11-nvme-driver-patcher",
      "category": "powershell",
      "includeInReadme": true,
      "includeInPortfolio": true,
      "order": 1,
      "branch": "main",
      "entrypoint": "NVMe_Driver_Patcher.ps1",
      "installKind": "powershell",
      "downloadKind": "download",
      "userscriptUrl": null,
      "liveUrl": null,
      "language": "C#",
      "descriptionOverride": "GUI to enable Windows Server 2025 NVMe driver on Win11",
      "featured": true,
      "featuredRank": 1,
      "currentlyBuilding": false,
      "currentlyBuildingText": null,
      "allowPublicMedical": false,
      "aliasOf": null,
      "suppressionReason": null,
      "notes": null
    },
    {
      "repo": "OpenCut",
      "title": "OpenCut",
      "category": "python",
      "includeInReadme": true,
      "includeInPortfolio": true,
      "order": 24,
      "branch": "main",
      "entrypoint": "Install.ps1",
      "installKind": "powershell",
      "downloadKind": "download",
      "userscriptUrl": null,
      "liveUrl": null,
      "language": "Python",
      "descriptionOverride": "AI-powered video editing automation for Premiere Pro. Caption generation, audio processing, VFX",
      "featured": true,
      "featuredRank": 2,
      "currentlyBuilding": false,
      "currentlyBuildingText": null,
      "allowPublicMedical": false,
      "aliasOf": null,
      "suppressionReason": null,
      "notes": null
    },
    {
      "repo": "project-nomad-desktop",
      "title": "project-nomad-desktop",
      "category": "python",
      "includeInReadme": true,
      "includeInPortfolio": true,
      "order": 1,
      "branch": "master",
      "entrypoint": "nomad.py",
      "installKind": "python",
      "downloadKind": "download",
      "userscriptUrl": null,
      "liveUrl": null,
      "language": "Python",
      "descriptionOverride": "Offline survival command center. Maps, AI chat, situation room, NukeMap, supply tracking",
      "featured": true,
      "featuredRank": 3,
      "currentlyBuilding": false,
      "currentlyBuildingText": null,
      "allowPublicMedical": false,
      "aliasOf": null,
      "suppressionReason": null,
      "notes": null
    },
    {
      "repo": "LibreSpot",
      "title": "LibreSpot",
      "category": "powershell",
      "includeInReadme": true,
      "includeInPortfolio": true,
      "order": 3,
      "branch": "main",
      "entrypoint": "LibreSpot.ps1",
      "installKind": "powershell",
      "downloadKind": "download",
      "userscriptUrl": null,
      "liveUrl": null,
      "language": "PowerShell",
      "descriptionOverride": "Spotify customization. Automates Spicetify, themes, extensions",
      "featured": true,
      "featuredRank": 4,
      "currentlyBuilding": false,
      "currentlyBuildingText": null,
      "allowPublicMedical": false,
      "aliasOf": null,
      "suppressionReason": null,
      "notes": null
    },
    {
      "repo": "VideoSubtitleRemover",
      "title": "VideoSubtitleRemover",
      "category": "media",
      "includeInReadme": true,
      "includeInPortfolio": true,
      "order": 5,
      "branch": "main",
      "entrypoint": "VideoSubtitleRemover.py",
      "installKind": "python",
      "downloadKind": null,
      "userscriptUrl": null,
      "liveUrl": null,
      "language": "Python",
      "descriptionOverride": "Remove hardcoded subtitles from video",
      "featured": true,
      "featuredRank": 5,
      "currentlyBuilding": false,
      "currentlyBuildingText": null,
      "allowPublicMedical": false,
      "aliasOf": null,
      "suppressionReason": null,
      "notes": null
    },
    {
      "repo": "Astra-Deck",
      "title": "Astra-Deck",
      "category": "extensions",
      "includeInReadme": true,
      "includeInPortfolio": true,
      "order": 1,
      "branch": "main",
      "entrypoint": null,
      "installKind": null,
      "downloadKind": "zip-xpi",
      "userscriptUrl": null,
      "liveUrl": null,
      "language": "JavaScript",
      "descriptionOverride": "Premium YouTube enhancement extension. 150+ features for Chrome & Firefox",
      "featured": true,
      "featuredRank": 6,
      "currentlyBuilding": false,
      "currentlyBuildingText": null,
      "allowPublicMedical": false,
      "aliasOf": null,
      "suppressionReason": null,
      "notes": null
    },
    {
      "repo": "Network_Security_Auditor",
      "title": "Network_Security_Auditor",
      "category": "powershell",
      "includeInReadme": true,
      "includeInPortfolio": true,
      "order": 2,
      "branch": "main",
      "entrypoint": "NetworkSecurityAudit.ps1",
      "installKind": "powershell",
      "downloadKind": null,
      "userscriptUrl": null,
      "liveUrl": null,
      "language": "PowerShell",
      "descriptionOverride": "67 automated checks across 8 security domains, MITRE ATT&CK mapping",
      "featured": true,
      "featuredRank": 7,
      "currentlyBuilding": false,
      "currentlyBuildingText": null,
      "allowPublicMedical": false,
      "aliasOf": null,
      "suppressionReason": null,
      "notes": null
    },
    {
      "repo": "ZeusWatch",
      "title": "ZeusWatch",
      "category": "android",
      "includeInReadme": true,
      "includeInPortfolio": true,
      "order": 1,
      "branch": "main",
      "entrypoint": null,
      "installKind": null,
      "downloadKind": "apk",
      "userscriptUrl": null,
      "liveUrl": null,
      "language": "Kotlin",
      "descriptionOverride": "Premium dark weather app. No API keys required",
      "featured": true,
      "featuredRank": 8,
      "currentlyBuilding": false,
      "currentlyBuildingText": null,
      "allowPublicMedical": false,
      "aliasOf": null,
      "suppressionReason": null,
      "notes": null
    },
    {
      "repo": "ClearCut",
      "title": "ClearCut",
      "category": "android",
      "includeInReadme": true,
      "includeInPortfolio": true,
      "order": 2,
      "branch": "master",
      "entrypoint": null,
      "installKind": null,
      "downloadKind": "apk",
      "userscriptUrl": null,
      "liveUrl": null,
      "language": "Kotlin",
      "descriptionOverride": "Full-featured Android video editor. Kotlin, Jetpack Compose, and Media3",
      "featured": true,
      "featuredRank": 9,
      "currentlyBuilding": false,
      "currentlyBuildingText": null,
      "allowPublicMedical": false,
      "aliasOf": null,
      "suppressionReason": null,
      "notes": null
    },
    {
      "repo": "HostShield",
      "title": "HostShield",
      "category": "android",
      "includeInReadme": true,
      "includeInPortfolio": true,
      "order": 3,
      "branch": "main",
      "entrypoint": null,
      "installKind": null,
      "downloadKind": "apk",
      "userscriptUrl": null,
      "liveUrl": null,
      "language": "Kotlin",
      "descriptionOverride": "AMOLED-dark hosts-based ad blocker. Inspired by AdAway",
      "featured": true,
      "featuredRank": 10,
      "currentlyBuilding": false,
      "currentlyBuildingText": null,
      "allowPublicMedical": false,
      "aliasOf": null,
      "suppressionReason": null,
      "notes": null
    },
    {
      "repo": "WinForge",
      "title": "WinForge",
      "category": "powershell",
      "includeInReadme": true,
      "includeInPortfolio": true,
      "order": 4,
      "branch": "main",
      "entrypoint": "WinForge.ps1",
      "installKind": "powershell",
      "downloadKind": null,
      "userscriptUrl": null,
      "liveUrl": null,
      "language": "PowerShell",
      "descriptionOverride": "All-in-one Windows provisioning suite. App installer, tweaks, features, updates",
      "featured": false,
      "featuredRank": null,
      "currentlyBuilding": false,
      "currentlyBuildingText": null,
      "allowPublicMedical": false,
      "aliasOf": null,
      "suppressionReason": null,
      "notes": null
    },
    {
      "repo": "Debloat-Win11",
      "title": "Debloat-Win11",
      "category": "powershell",
      "includeInReadme": true,
      "includeInPortfolio": true,
      "order": 5,
      "branch": "main",
      "entrypoint": "Debloat-Win11.ps1",
      "installKind": "powershell",
      "downloadKind": null,
      "userscriptUrl": null,
      "liveUrl": null,
      "language": "PowerShell",
      "descriptionOverride": "Enterprise Windows 11 debloating with AppX removal, Office cleanup, telemetry blocking",
      "featured": false,
      "featuredRank": null,
      "currentlyBuilding": false,
      "currentlyBuildingText": null,
      "allowPublicMedical": false,
      "aliasOf": null,
      "suppressionReason": null,
      "notes": null
    },
    {
      "repo": "Restore-WindowsDefaults",
      "title": "Restore-WindowsDefaults",
      "category": "powershell",
      "includeInReadme": true,
      "includeInPortfolio": true,
      "order": 6,
      "branch": "main",
      "entrypoint": "Restore-WindowsDefaults.ps1",
      "installKind": "powershell",
      "downloadKind": null,
      "userscriptUrl": null,
      "liveUrl": null,
      "language": "PowerShell",
      "descriptionOverride": "Reverse debloat changes and restore Windows to factory defaults",
      "featured": false,
      "featuredRank": null,